{
  "$schema": "https://json-schema.org/draft/2020-12/schema",
  "$id": "https://reform.local/schema/figma-bridge-export-v3",
  "title": "Figma bridge export (phases 1–3, plugin v0.2+)",
  "type": "object",
  "required": ["meta", "roots"],
  "properties": {
    "meta": {
      "type": "object",
      "required": ["pluginVersion", "phase", "exportedAt"],
      "properties": {
        "pluginVersion": { "type": "string" },
        "phase": { "type": "integer", "minimum": 1, "maximum": 3 },
        "scope": { "type": "string", "enum": ["selection", "page"] },
        "exportedAt": { "type": "string", "format": "date-time" },
        "fileKey": { "type": ["string", "null"] },
        "fileName": { "type": "string" },
        "pageId": { "type": "string" },
        "pageName": { "type": "string" },
        "nodeCount": { "type": "integer" },
        "omittedCount": { "type": "integer", "description": "Nodes dropped as `omitted` for hitting maxNodes/maxDepth (0 = nothing truncated)." },
        "maxDepth": { "type": "integer" },
        "maxNodes": { "type": "integer" }
      }
    },
    "roots": {
      "type": "array",
      "description": "Serialized scene nodes (recursive children).",
      "items": { "$ref": "#/$defs/node" }
    },
    "variables": {
      "type": ["object", "null"],
      "description": "Present when phase >= 2: COMPACT, referenced-only token table. Each variable is resolved to its default-mode `value` (+ `cssColor` for COLOR). Paints that bind a variable also carry a resolved `tokens` map at the paint."
    },
    "rasters": {
      "type": "object",
      "description": "Present when phase 3 + plugin raster option: map key -> base64. Key is a node id (PNG of a small root node) or an image hash (raw IMAGE-fill bytes). Fetch one on demand via the figma_bridge_get_raster MCP tool.",
      "additionalProperties": { "type": "string", "contentEncoding": "base64" }
    }
  },
  "additionalProperties": true,
  "$defs": {
    "node": {
      "type": "object",
      "description": "One serialized scene node. additionalProperties is true: fields are present only when meaningful for the node type/phase.",
      "required": ["id", "type", "name"],
      "additionalProperties": true,
      "properties": {
        "id": { "type": "string" },
        "type": { "type": "string", "description": "Figma node type, e.g. FRAME, TEXT, VECTOR, INSTANCE." },
        "name": { "type": "string" },
        "visible": { "type": "boolean" },
        "locked": { "type": "boolean" },
        "opacity": { "type": "number" },
        "blendMode": { "type": "string" },
        "rotation": { "type": "number", "description": "Degrees, Figma convention (counter-clockwise positive)." },
        "omitted": { "type": "boolean", "description": "Node was truncated; see `reason` (maxNodes/maxDepth)." },
        "reason": { "type": "string" },
        "bbox": {
          "type": ["object", "null"],
          "description": "Bounding box. `space:absolute` = page coordinates (from absoluteBoundingBox). `space:relative` = parent-relative fallback (x/y of LayoutMixin). Never mix the two spaces.",
          "properties": {
            "x": { "type": "number" },
            "y": { "type": "number" },
            "width": { "type": "number" },
            "height": { "type": "number" },
            "space": { "type": "string", "enum": ["absolute", "relative"] }
          }
        },
        "rel": {
          "type": "object",
          "description": "Parent-relative box (child absolute minus parent absolute) — CSS-ready left/top/width/height for absolutely-positioned children.",
          "properties": {
            "x": { "type": "number" },
            "y": { "type": "number" },
            "width": { "type": "number" },
            "height": { "type": "number" }
          }
        },
        "cornerRadius": { "type": "number" },
        "rectangleCornerRadii": {
          "type": "array",
          "description": "[topLeft, topRight, bottomRight, bottomLeft] when corners differ.",
          "items": { "type": "number" }
        },
        "isMask": { "type": "boolean" },
        "maskType": { "type": "string" },
        "fills": { "type": "array", "description": "Paints. SOLID has color {r,g,b} 0..1 + `cssColor` (#hex/rgba, opacity folded in). GRADIENT_* has gradientStops[{position,color,cssColor}] + gradientTransform + `cssGradient` (a ready linear/radial/conic-gradient string; radial/angular/diamond are approximate). IMAGE has imageHash (opaque, not a URL) + scaleMode. A paint that binds a variable also has `tokens` (field -> {id,name,collection,value,cssColor})." },
        "css": { "type": "object", "description": "Ready-to-apply CSS for THIS node, composed from the derived pieces: background (cssColor or cssGradient), border (stroke), borderRadius, boxShadow, filter/backdropFilter, opacity, and — when the node is not an auto-layout child — position/left/top/width/height from `rel`. Auto-layout containers also expose `layout.css` (flexbox)." },
        "strokes": { "type": "array" },
        "strokeWeight": { "type": "number" },
        "strokeAlign": { "type": "string" },
        "dashPattern": { "type": "array", "items": { "type": "number" } },
        "strokeCap": { "type": "string" },
        "strokeJoin": { "type": "string" },
        "effects": { "type": "array", "description": "Shadows/blurs. At phase >= 2, shadows add color/cssColor/offset/radius/spread; the composed `box-shadow`/`filter` live in the node's `css` block." },
        "layout": {
          "type": "object",
          "description": "Container auto-layout (FRAME/COMPONENT/INSTANCE): layoutMode, sizing modes, align, padding, itemSpacing, layoutWrap, layoutGrids, and `css` — a ready flexbox block (display/flexDirection/justifyContent/alignItems/gap/padding/flexWrap)."
        },
        "layoutSelf": {
          "type": "object",
          "description": "Per-node responsive sizing. constraints {horizontal,vertical} for absolute children; layoutSizingHorizontal/Vertical (FIXED|HUG|FILL), layoutGrow, layoutAlign, min/maxWidth/Height for auto-layout participants.",
          "properties": {
            "constraints": { "type": "object" },
            "layoutSizingHorizontal": { "type": "string" },
            "layoutSizingVertical": { "type": "string" },
            "layoutGrow": { "type": "number" },
            "layoutAlign": { "type": "string" },
            "minWidth": { "type": "number" },
            "maxWidth": { "type": "number" },
            "minHeight": { "type": "number" },
            "maxHeight": { "type": "number" }
          }
        },
        "text": {
          "type": "object",
          "description": "TEXT nodes. Node-level fields plus, at phase >= 2: `segments` (per-range styling from getStyledTextSegments so bold/colored/sized runs survive), `fontWeight`, and CSS-ready `cssLineHeight`/`cssLetterSpacing`/`cssTextTransform`/`cssTextDecoration` (also per segment)."
        },
        "geometry": {
          "type": "object",
          "description": "Vector shapes (VECTOR/BOOLEAN_OPERATION/LINE/POLYGON/STAR): fillGeometry/strokeGeometry are SVG path lists [{windingRule,data}] re-emittable as <path d>. booleanOperation on BOOLEAN_OPERATION nodes."
        },
        "styleRefs": {
          "type": "object",
          "description": "phase >= 2: fillStyleId/strokeStyleId/effectStyleId references (IDs only; the styles themselves are not serialized)."
        },
        "component": {
          "type": "object",
          "description": "phase 3: INSTANCE variant/component properties + mainComponent ref; COMPONENT/COMPONENT_SET property definitions."
        },
        "children": {
          "type": "array",
          "items": { "$ref": "#/$defs/node" }
        }
      }
    }
  }
}
